{
 "id": "lecture-2026-001",
 "제목": "주간 안창민 제11호 — 안규백 장관 논란, 이재명 정부 인사정책 시험대",
 "모드": "강의",
 "작성일": "2026-07-19",
 "작성자": "안창민 FC",
 "요약": "안규백 장관 논란, 이재명 정부 인사정책 시험대 · 주택담보대출 '반토막', 향방은? · OpenAI, GPT-5.6 SOL 출시…AI 지형 변화 예고 · 국민연금 보험료 인상, 가입자 부담 가중",
 "출처": "care:weekly-11",
 "페이지": [
  {
   "유형": "표지",
   "킥커": "주간 안창민 제11호 · 2026년 7월 2주차",
   "제목": "안규백 장관 논란, 이재명 정부 인사정책 시험대",
   "부제": "발행 안창민 FC · 2026-07-13",
   "이미지": "data/care/issues/weekly-11/cover.jpg",
   "스크립트": "안규백 장관 논란, 이재명 정부 인사정책 시험대 · 주택담보대출 '반토막', 향방은? · OpenAI, GPT-5.6 SOL 출시…AI 지형 변화 예고 · 국민연금 보험료 인상, 가입자 부담 가중",
   "번호": 1
  },
  {
   "유형": "본문",
   "킥커": "주간 안창민 제11호",
   "제목": "차례",
   "본문": [
    {
     "t": "li",
     "x": "[시사] 안규백 장관 논란, 이재명 정부 인사정책 시험대 — 국방부 수장 둘러싼 의혹, 정부 국정운영 동력에 영향"
    },
    {
     "t": "li",
     "x": "[경제] 주택담보대출 '반토막', 향방은? — 고금리 장기화 속 대출 감소, 부동산 시장의 미래는?"
    },
    {
     "t": "li",
     "x": "[교양] OpenAI, GPT-5.6 SOL 출시…AI 지형 변화 예고 — 새로운 AI 모델, 산업 전반에 혁신적 파급력 전망"
    },
    {
     "t": "li",
     "x": "[보험] 국민연금 보험료 인상, 가입자 부담 가중 — 소득대체율 논의 속 보험료율 인상 압박 고조"
    }
   ],
   "번호": 2
  },
  {
   "유형": "이미지",
   "킥커": "시사",
   "제목": "안규백 장관 논란, 이재명 정부 인사정책 시험대",
   "부제": "국방부 수장 둘러싼 의혹, 정부 국정운영 동력에 영향",
   "이미지": "data/care/issues/weekly-11/art-1.jpg",
   "스크립트": "이재명 정부의 안규백 국방부 장관을 둘러싼 '탈영 의혹' 수사가 진행되며 정부 인사 정책의 신뢰성이 도마 위에 올랐습니다. 안 장관은 방위 출신으로 국방부 장관직에 임명된 이후, 과거 복무 기간 가산 문제 등 개인적 의혹과 함께 사관학교 통합 개편 등 국방 정책 방향에 대한 군 안팎의 반발에 직면하고 있습니다. 이러한 논란은 이재명 정부 출범 후 첫 국회 국정감사에서도 주요 쟁점으로 부각되었으며, 인사 혼란이 군 기강 해이로 이어질 수 있다는 우려도 제기되고 있습니다. 일각에서는 안 장관의 임명이 이재명 대통령의 '사적 인사'라는 비판과 함께, 정부 정책 집행의 방향성에 대한 의구심을 표하고 있습니다. 안 장관을 둘러싼 의혹과 정책 논란은 이재명 정부의 국정운영 동력과 향후 인사 정책 기조에 중대한 영향을 미칠 것으로 보입니다.",
   "번호": 3
  },
  {
   "유형": "본문",
   "킥커": "시사",
   "제목": "안규백 국방부 장관 논란, 이재명 정부 인사정책의 향방은?",
   "본문": [
    {
     "t": "p",
     "x": "2026년 7월 8일 현재, 이재명 정부의 안규백 국방부 장관을 둘러싼 논란이 뜨겁습니다. 안 장관의 '탈영 의혹' 수사가 진행되는 가운데, 이는 이재명 정부의 국방 정책 신뢰성과 더 나아가 전반적인 인사 정책의 향방을 가늠하는 중대한 시험대로 떠오르고 있습니다. 고위 공직자의 자질과 도덕성 논란은 단순한 개인의 문제를 넘어 정부의 국정운영 동력과 직결되기 때문입니다."
    }
   ],
   "번호": 4
  },
  {
   "유형": "본문",
   "킥커": "시사",
   "제목": "안규백 장관을 둘러싼 주요 쟁점들",
   "본문": [
    {
     "t": "p",
     "x": "안규백 국방부 장관은 방위 출신으로서 국방부 수장에 임명된 이례적인 인물입니다. 그를 둘러싼 논란은 크게 두 가지 축으로 나뉩니다."
    },
    {
     "t": "p",
     "x": "첫째, 개인적 의혹입니다. 가장 핵심적인 것은 '탈영 의혹' 수사입니다. 과거 복무 기간 가산 문제 등 병역과 관련된 의혹들이 제기되며, 국방부 장관으로서의 도덕성과 자격에 대한 근본적인 질문이 던져지고 있습니다. 특히 방위 출신이라는 점이 부각되면서, 군 내부에서는 물론 일반 국민들 사이에서도 적잖은 논란을 야기하고 있습니다. 2025년 국방부 국정감사 당시 안 장관이 눈을 비비는 모습이 포착되며, 인사 혼란 속에 군 기강 해이가 잇따르고 있다는 지적도 있었습니다. 이는 고위 공직자의 개인적 문제가 조직 전체의 사기와 기강에 미칠 수 있는 영향을 보여주는 단면입니다."
    },
    {
     "t": "p",
     "x": "둘째, 국방 정책 방향에 대한 논란입니다. 안 장관은 취임 후 사관학교 통합 개편 등 군 조직 개혁을 추진하려 했으나, 이에 대한 군 안팎의 반발에 직면했습니다. 군 조직 개혁은 사회적 합의와 군 내부의 공감대가 필수적이지만, 안 장관을 둘러싼 개인적 의혹이 불거지면서 정책 추진 동력이 약화되고 있다는 평가가 지배적입니다. 또한, 북한과의 관계 및 한미동맹 문제 등 민감한 국방 현안에 대한 이재명 정부의 정책 방향과 맞물려 안 장관의 리더십은 더욱 큰 시험대에 올랐습니다. 트럼프 전 대통령의 북한 문제에 대한 관심과 통일부 장관의 한미군사훈련 유예 주장 등 복합적인 대외 변수 속에서 안 장관의 역할은 더욱 중요해질 수밖에 없습니다."
    }
   ],
   "번호": 5
  },
  {
   "유형": "본문",
   "킥커": "시사",
   "제목": "이재명 정부 인사정책의 그림자",
   "본문": [
    {
     "t": "p",
     "x": "안규백 장관 논란은 비단 한 인물의 문제가 아닌, 이재명 정부의 전반적인 인사정책 기조와 맞물려 해석되고 있습니다. 일각에서는 안 장관의 임명을 이재명 대통령의 '사적 인사'로 규정하며, 고립적 인사가 정부 정책 집행의 방향성을 왜곡할 수 있다는 비판을 제기하고 있습니다. 2025년 7월 보도된 내용에 따르면, '보좌진들도 제대로 뿔났다'는 표현이 나올 정도로 강선우 의원 등 여권 내부에서도 인사에 대한 불만이 표출된 바 있습니다."
    },
    {
     "t": "p",
     "x": "이재명 정부는 출범 초기부터 '능력과 전문성'을 강조하며 국정운영의 효율성을 높이겠다고 천명했습니다. 그러나 안규백 장관 사례처럼 고위직 인사를 둘러싼 논란이 계속될 경우, 정부가 추진하는 주요 정책들의 신뢰성과 추진력은 크게 저하될 수밖에 없습니다. 특히 국방 분야는 국가 안보와 직결되는 민감한 영역이므로, 장관의 리더십과 도덕성은 그 어떤 분야보다 중요하게 여겨집니다."
    }
   ],
   "번호": 6
  },
  {
   "유형": "본문",
   "킥커": "시사",
   "제목": "향후 전망과 과제",
   "본문": [
    {
     "t": "p",
     "x": "안규백 국방부 장관을 둘러싼 '탈영 의혹' 수사 결과는 이재명 정부의 국정운영에 중대한 변수가 될 것입니다. 만약 의혹이 사실로 드러나거나, 국민적 신뢰를 회복하지 못한다면 안 장관의 거취는 물론, 이재명 정부의 향후 인사 정책에도 큰 변화가 불가피할 것입니다."
    },
    {
     "t": "p",
     "x": "이재명 정부는 이번 사태를 통해 인사 검증 시스템을 재점검하고, 투명하고 공정한 인사 원칙을 확립해야 할 과제를 안게 되었습니다. 단순히 개인의 능력만을 보는 것을 넘어, 고위 공직자가 갖춰야 할 도덕성과 국민적 눈높이를 충족시킬 수 있는 인재를 등용하는 것이 중요합니다. 또한, 정책 추진에 있어 군 내부 및 사회 각계각층과의 소통과 공감대 형성을 통해 국정운영의 안정성을 확보해야 할 것입니다."
    },
    {
     "t": "p",
     "x": "결론적으로 안규백 국방부 장관 논란은 이재명 정부가 직면한 인사 정책의 현실과 과제를 여실히 보여주는 사례입니다. 이재명 정부가 이 난관을 어떻게 헤쳐나갈지, 그리고 이를 통해 어떤 인사 정책의 향방을 보여줄지 귀추가 주목됩니다. 이는 단순히 국방부의 문제를 넘어, 이재명 정부의 국정운영 전반에 대한 국민적 신뢰를 좌우할 핵심적인 사안이 될 것입니다."
    }
   ],
   "스크립트": "최근 안규백 국방부 장관을 둘러싼 논란은 비단 국방 분야에만 국한된 문제가 아닙니다. 정부 고위직 인사에 대한 검증과 투명성은 국정 운영의 신뢰도를 결정하는 중요한 척도가 됩니다. 특히 이재명 정부의 인사 정책이 '사적 인사'라는 비판을 받는다면, 이는 정책의 일관성과 추진력에도 부정적인 영향을 미칠 수 있습니다. 우리 사회의 시스템이 제대로 작동하고 있는지, 그리고 그로 인해 우리 경제와 가계에 어떤 파급 효과가 있을지 면밀히 지켜봐야 할 시점입니다. 결국, 정부의 안정적인 운영은 우리 모두의 자산 가치와도 직결되기 때문입니다.",
   "번호": 7
  },
  {
   "유형": "이미지",
   "킥커": "경제",
   "제목": "주택담보대출 '반토막', 향방은?",
   "부제": "고금리 장기화 속 대출 감소, 부동산 시장의 미래는?",
   "이미지": "data/care/issues/weekly-11/art-2.jpg",
   "스크립트": "최근 주택담보대출 시장이 크게 위축되며 '반토막' 수준의 감소세를 보이고 있습니다. 2026년 7월 현재, 은행 주택담보대출 금리 상단이 7.50%를 돌파하는 등 고금리 기조가 이어지면서 수도권 주요 신도시 아파트 가격이 30~40% 급락하는 사례도 나타나고 있습니다. 한국은행이 2025년 기준금리를 2.50%로 인하했음에도 불구하고, 높은 대출 금리와 경기 둔화 우려로 인해 주택 거래량이 급감하고 가계부채 증가세가 둔화되는 양상입니다. 특히 서울 아파트 거래량은 전달 대비 절반 수준으로 줄어들며 시장이 소강상태에 진입했다는 분석이 나옵니다. 이러한 상황은 주택담보대출을 통한 주택 구매가 어려워지면서 부동산 시장 전반의 침체로 이어지고 있습니다.",
   "번호": 8
  },
  {
   "유형": "본문",
   "킥커": "경제",
   "제목": "주택담보대출 '반토막' 시대, 부동산 시장의 새로운 변곡점",
   "본문": [
    {
     "t": "p",
     "x": "2026년 7월 현재, 대한민국 부동산 시장은 '주택담보대출 반토막'이라는 전례 없는 국면을 맞이하고 있습니다. 이는 단순히 대출 규모의 감소를 넘어, 주택 시장의 근본적인 변화를 예고하는 강력한 신호로 해석됩니다. 고금리 장기화와 경기 둔화 우려가 복합적으로 작용하며, 과거 '영끌'로 대변되던 주택 구매 열기는 차갑게 식어가고 있습니다. 과연 이러한 흐름은 일시적인 현상일까요, 아니면 새로운 부동산 패러다임의 시작일까요?"
    }
   ],
   "번호": 9
  },
  {
   "유형": "본문",
   "킥커": "경제",
   "제목": "고금리 충격과 주택담보대출 시장의 위축",
   "본문": [
    {
     "t": "p",
     "x": "주택담보대출 시장의 위축은 무엇보다 높은 금리에서 비롯됩니다. 2026년 7월 현재, 시중은행의 주택담보대출 금리 상단은 7.50%를 돌파하며 차주들에게 상당한 부담으로 작용하고 있습니다. 이는 2025년 한국은행이 기준금리를 2.50%로 인하했음에도 불구하고, 시장금리가 여전히 높은 수준을 유지하고 있음을 보여줍니다. 기준금리 인하가 시중금리 하락으로 이어져 주택 가격 상승과 가계부채 증가를 자극할 수 있다는 우려가 있었지만, 실제로는 대출 수요 자체가 급감하며 시장에 미치는 영향이 제한적인 상황입니다."
    },
    {
     "t": "p",
     "x": "실제로 수도권 주요 신도시인 송도, 동탄, 인덕원 등에서는 아파트 가격이 30~40% 급락하는 사례를 넘어 '반토막' 수준의 하락세를 보이는 곳도 나타나고 있습니다. 이는 높은 대출 이자를 감당하지 못하거나, 추가적인 가격 하락을 우려하는 매도 심리가 확산된 결과입니다. 금리가 높다는 것은 곧 원리금 상환 부담이 커진다는 의미이며, 이는 주택 구매를 망설이게 하는 가장 큰 요인으로 작용합니다. 예를 들어, 5억 원을 연 7.5% 금리로 30년 만기 원리금 균등 상환할 경우, 매월 약 350만 원을 상환해야 합니다. 이는 상당수 가구의 월 소득에서 큰 비중을 차지하는 금액으로, 주택 구매 결정을 어렵게 만듭니다."
    }
   ],
   "번호": 10
  },
  {
   "유형": "본문",
   "킥커": "경제",
   "제목": "거래량 급감과 시장의 소강상태",
   "본문": [
    {
     "t": "p",
     "x": "주택담보대출의 감소는 곧 주택 거래량의 급감으로 이어집니다. 최근 데이터에 따르면, 서울 아파트 거래량은 전달 대비 '반토막' 수준으로 줄어들며 시장이 사실상 소강상태에 진입했다는 분석이 지배적입니다. 이는 매수자와 매도자 간의 가격 눈높이 차이가 커진 데다, 대출을 통한 자금 조달이 어려워진 것이 복합적으로 작용한 결과입니다."
    },
    {
     "t": "p",
     "x": "과거 '특례보금자리론'과 같은 정책 대출이 시장의 유동성을 공급하며 거래 활성화에 기여했지만, 이러한 정책 대출의 문턱이 높아지거나 종료되면서 개별적으로 주택담보대출을 이용해야 하는 상황이 되었습니다. 하지만 높은 금리로 인해 대출 실행 자체가 부담스러워지면서, 실수요자들마저 주택 구매를 미루는 현상이 심화되고 있습니다. 이는 주택 시장의 유동성을 급격히 낮추고, 가격 하락 압력을 가중시키는 요인으로 작용합니다."
    }
   ],
   "번호": 11
  },
  {
   "유형": "본문",
   "킥커": "경제",
   "제목": "향후 주택담보대출 및 부동산 시장의 전망",
   "본문": [
    {
     "t": "p",
     "x": "주택담보대출 시장의 '반토막' 현상은 단기적인 조정이 아닌, 중장기적인 부동산 시장의 변화를 예고할 수 있습니다. 전문가들은 다음과 같은 몇 가지 시나리오를 제시합니다."
    },
    {
     "t": "p",
     "x": "고금리 장기화 시나리오: 현재의 고금리 기조가 예상보다 길어진다면, 주택담보대출 수요는 더욱 위축되고 부동산 가격 하락 압력은 지속될 것입니다. 특히 변동금리 대출을 받은 차주들의 상환 부담이 가중되어 '영끌족'의 어려움이 심화될 수 있습니다. 이는 경매 물건 증가로 이어져 시장에 추가적인 충격을 줄 가능성도 배제할 수 없습니다."
    },
    {
     "t": "p",
     "x": "금리 인하와 시장 회복 시나리오: 한국은행의 추가적인 기준금리 인하가 단행되고, 이것이 시중금리 하락으로 이어진다면 주택담보대출 수요가 점진적으로 회복될 수 있습니다. 하지만 과거와 같은 급격한 'V자 반등'보다는, 경제 성장률 둔화(한국은행 2025년 성장률 전망 0.8%)와 가계부채 총량 관리의 필요성 등으로 인해 완만한 회복세를 보일 가능성이 높습니다. 또한, 금리 인하가 가계부채 증가로 이어질 경우, 정부와 한국은행이 다시금 규제 카드를 꺼낼 가능성도 상존합니다."
    },
    {
     "t": "p",
     "x": "수도권과 지방의 양극화 심화: 주택담보대출의 어려움은 특히 지방 부동산 시장에 더 큰 타격을 줄 수 있습니다. 수도권은 여전히 인구 유입과 인프라 확충 기대감이 존재하지만, 지방은 인구 감소와 산업 기반 약화로 인해 주택 수요가 더욱 줄어들 수 있습니다. 이는 주택담보대출을 통한 자금 조달이 어려워질수록, 투자 가치가 높은 곳으로 자금이 쏠리는 양극화를 심화시킬 것입니다."
    }
   ],
   "번호": 12
  },
  {
   "유형": "본문",
   "킥커": "경제",
   "제목": "자산 관리 전략의 변화",
   "본문": [
    {
     "t": "p",
     "x": "이러한 시장 상황에서 개인의 자산 관리 전략은 더욱 신중해져야 합니다. 무리한 주택 구매보다는 현재 보유 자산을 효율적으로 관리하고, 다가올 변화에 대비하는 것이 중요합니다."
    },
    {
     "t": "p",
     "x": "부채 관리의 중요성: 높은 금리 시대에는 부채 관리가 최우선입니다. 변동금리 대출을 고정금리로 전환하거나, 여유 자금이 있다면 대출 원금을 상환하여 이자 부담을 줄이는 것이 현명합니다. 특히 주택담보대출 금리 상단 7.50%는 과거와 비교할 수 없는 수준이므로, 이자 비용을 최소화하는 노력이 필요합니다."
    },
    {
     "t": "p",
     "x": "현금 흐름 확보: 불확실한 경제 상황에서는 현금 흐름을 안정적으로 확보하는 것이 중요합니다. 예기치 않은 상황에 대비할 수 있는 비상 자금을 마련하고, 고정 지출을 점검하여 불필요한 지출을 줄이는 노력이 필요합니다."
    },
    {
     "t": "p",
     "x": "절세 전략의 재정비: 주택 시장의 변화는 상속, 증여, 양도소득세 등 세금 관련 전략에도 영향을 미칩니다. 예를 들어, 주택 가격 하락기에 증여를 고려하거나, 다주택자의 경우 양도 시점을 신중하게 결정하는 등 전문가와 상담하여 자신에게 맞는 절세 전략을 수립해야 합니다. 특히, 부동산 가치 하락은 증여세 산정 시 유리하게 작용할 수 있는 기회가 될 수도 있습니다."
    },
    {
     "t": "p",
     "x": "주택담보대출 '반토막' 현상은 단순히 숫자의 변화가 아닌, 우리 사회의 자산 형성 방식과 가치관에 큰 영향을 미칠 수 있는 중대한 전환점입니다. 단기적인 시장의 등락에 일희일비하기보다는, 장기적인 관점에서 자신만의 자산 관리 원칙을 세우고 꾸준히 실행해 나가는 지혜가 필요한 시점입니다. 안창민 FC는 고객 여러분의 안정적인 자산 관리를 위해 언제나 최선을 다할 것입니다."
    }
   ],
   "스크립트": "고객 여러분, 최근 주택담보대출 시장의 급격한 변화에 많은 분들이 불안감을 느끼실 겁니다. 금리 인하 기대감이 있었음에도 불구하고, 실제 체감하는 대출 금리는 여전히 부담스러운 수준입니다. 제가 보기에 이러한 상황은 당분간 지속될 가능성이 높습니다. 무리한 대출을 통한 자산 증식보다는, 현재 자산을 안정적으로 지키고 미래를 대비하는 현명한 전략이 더욱 중요해졌습니다. 특히 상속, 증여, 절세 측면에서 이러한 시장 변화를 어떻게 활용할지 고민해야 할 시점입니다. 전문가와 함께 장기적인 관점에서 자산 계획을 세우는 것이 중요하다고 말씀드리고 싶습니다.",
   "번호": 13
  },
  {
   "유형": "이미지",
   "킥커": "교양",
   "제목": "OpenAI, GPT-5.6 SOL 출시…AI 지형 변화 예고",
   "부제": "새로운 AI 모델, 산업 전반에 혁신적 파급력 전망",
   "이미지": "data/care/issues/weekly-11/art-3.jpg",